# Problem Solving

# LeetCode Daily Question
1. [2379. Minimum Recolors to Get K Consecutive Black Blocks : 08-03-2025](https://leetcode.com/problems/minimum-recolors-to-get-k-consecutive-black-blocks/description/?envType=daily-question&envId=2025-03-08)
2. [3208. Alternating Groups II : 09-03-2025](https://leetcode.com/problems/alternating-groups-ii/description/?envType=daily-question&envId=2025-03-09)
3. [1358. Number of Substrings Containing All Three Characters : 11-03-2025](https://leetcode.com/problems/number-of-substrings-containing-all-three-characters/description/?envType=daily-question&envId=2025-03-11)
4. [2529. Maximum Count of Positive Integer and Negative Integer : 12-03-2025](https://leetcode.com/problems/maximum-count-of-positive-integer-and-negative-integer/description/?envType=daily-question&envId=2025-03-12)
5. [2206. Divide Array Into Equal Pairs : 17-03-2025](https://leetcode.com/problems/divide-array-into-equal-pairs/description/?envType=daily-question&envId=2025-03-17)
6. [3191. Minimum Operations to Make Binary Array Elements Equal to One I : 19-03-2025](https://leetcode.com/problems/minimum-operations-to-make-binary-array-elements-equal-to-one-i/description/?envType=daily-question&envId=2025-03-19)
7. [1920. Build Array from Permutation : 06-05-2025](https://leetcode.com/problems/build-array-from-permutation/?envType=daily-question&envId=2025-05-06)
8. [75. Sort Colors : 17-05-2025](https://leetcode.com/problems/sort-colors/description/?envType=daily-question&envId=2025-05-17)
9. [3024. Type of Triangle : 19-05-2025](https://leetcode.com/problems/type-of-triangle/description/?envType=daily-question&envId=2025-05-19)
10. [3355. Zero Array Transformation I : 20-05-2025](https://leetcode.com/problems/zero-array-transformation-i/description/?envType=daily-question&envId=2025-05-20)
11. [2942. Find Words Containing Character : 24-05-2025](https://leetcode.com/problems/find-words-containing-character/description/?envType=daily-question&envId=2025-05-24)
12. [2894. Divisible and Non-divisible Sums Difference : 27-05-2025](https://leetcode.com/problems/divisible-and-non-divisible-sums-difference/description/?envType=daily-question&envId=2025-05-27)
13. [135. Candy : 02-06-2025](https://leetcode.com/problems/candy/description/?envType=daily-question&envId=2025-06-02)
14. [2210. Count Hills and Valleys in an Array : 27-07-2025](https://leetcode.com/problems/count-hills-and-valleys-in-an-array/description/?envType=daily-question&envId=2025-07-27)
15. [2044. Count Number of Maximum Bitwise-OR Subsets : 28-07-2025](https://leetcode.com/problems/count-number-of-maximum-bitwise-or-subsets/description/?envType=daily-question&envId=2025-07-28)
16. [118. Pascal's Triangle : 01-08-2025](https://leetcode.com/problems/pascals-triangle/description/?envType=daily-question&envId=2025-08-01)
17. [904. Fruit Into Baskets : 04-08-2025](https://leetcode.com/problems/fruit-into-baskets/description/?envType=daily-question&envId=2025-08-04)
18. [3477. Fruits Into Baskets II : 05-08-2025](https://leetcode.com/problems/fruits-into-baskets-ii/description/?envType=daily-question&envId=2025-08-05)
19. [231. Power of Two : 09-08-2025](https://leetcode.com/problems/power-of-two/description/?envType=daily-question&envId=2025-08-09)
20. [326. Power of Three : 13-08-2025](https://leetcode.com/problems/power-of-three/description/?envType=daily-question&envId=2025-08-13)
21. [2264. Largest 3-Same-Digit Number in String : 14-08-2025](https://leetcode.com/problems/largest-3-same-digit-number-in-string/description/?envType=daily-question&envId=2025-08-14)
22. [342. Power of Four : 15-08-2025](https://leetcode.com/problems/power-of-four/description/?envType=daily-question&envId=2025-08-15)
23. [1323. Maximum 69 Number : 16-08-2025](https://leetcode.com/problems/maximum-69-number/description/?envType=daily-question&envId=2025-08-16)
24. [2348. Number of Zero-Filled Subarrays : 19-08-2025](https://leetcode.com/problems/number-of-zero-filled-subarrays/description/?envType=daily-question&envId=2025-08-19)
25. [3195. Find the Minimum Area to Cover All Ones I : 22-08-2025](https://leetcode.com/problems/find-the-minimum-area-to-cover-all-ones-i/description/?envType=daily-question&envId=2025-08-22)
26. [1493. Longest Subarray of 1's After Deleting One Element : 24-08-2025](https://leetcode.com/problems/longest-subarray-of-1s-after-deleting-one-element/description/?envType=daily-question&envId=2025-08-24)
27. [498. Diagonal Traverse : 25-08-2025](https://leetcode.com/problems/diagonal-traverse/description/?envType=daily-question&envId=2025-08-25)
28. [3000. Maximum Area of Longest Diagonal Rectangle : 26-08-2025](https://leetcode.com/problems/maximum-area-of-longest-diagonal-rectangle/description/?envType=daily-question&envId=2025-08-26)
29. [3021. Alice and Bob Playing Flower Game : 29-08-2025](https://leetcode.com/problems/alice-and-bob-playing-flower-game/description/?envType=daily-question&envId=2025-08-29)
30. [3516. Find Closest Person : 04-09-2025](https://leetcode.com/problems/find-closest-person/description/?envType=daily-question&envId=2025-09-04)
31. [3541. Find Most Frequent Vowel and Consonant : 13-09-2025](https://leetcode.com/problems/find-most-frequent-vowel-and-consonant/description/?envType=daily-question&envId=2025-09-13)
32. [976. Largest Perimeter Triangle : 28-09-2025](https://leetcode.com/problems/largest-perimeter-triangle/description/?envType=daily-question&envId=2025-09-28)
33. [1518. Water Bottles : 01-10-2025](https://leetcode.com/problems/water-bottles/description/?envType=daily-question&envId=2025-10-01)
34. [3100. Water Bottles II : 02-10-2025](https://leetcode.com/problems/water-bottles-ii/description/?envType=daily-question&envId=2025-10-02)
35. [1513. Number of Substrings With Only 1s : 16-11-2025](https://leetcode.com/problems/number-of-substrings-with-only-1s/description/?envType=daily-question&envId=2025-11-16)

# Implementation / Constructive
1. [A. Bit++](https://codeforces.com/problemset/problem/282/A)
2. [A. Chewbaсca and Number](https://codeforces.com/contest/514/problem/A)
3. [A. Beautiful Matrix](https://codeforces.com/contest/263/problem/A)
4. [A. Soft Drinking](https://codeforces.com/contest/151/problem/A)
5. [A. The New Year: Meeting Friends](https://codeforces.com/contest/723/problem/A)
6. [A. Text Volume](https://codeforces.com/problemset/problem/837/A)
7. [A. Sum of Round Numbers](https://codeforces.com/contest/1352/problem/A)
8. [A. Fox And Snake](https://codeforces.com/contest/510/problem/A)
9. [A. Anton and Polyhedrons](https://codeforces.com/problemset/problem/785/A)
10. [A. Arrival of the General](https://codeforces.com/contest/144/problem/A)
11. [A. In Search of an Easy Problem](https://codeforces.com/problemset/problem/1030/A)
12. [A. Presents](https://codeforces.com/contest/136/problem/A)
13. [A. Nearly Lucky Number](https://codeforces.com/contest/110/problem/A)
14. [A. Tram](https://codeforces.com/contest/116/problem/A)
15. [A. Wrong Subtraction](https://codeforces.com/problemset/problem/977/A)
16. [A. Soldier and Bananas](https://codeforces.com/contest/546/problem/A)

# Recursion
1. [509. Fibonacci Number](https://leetcode.com/problems/fibonacci-number/description/)

# Strings
1. [344. Reverse String](https://leetcode.com/problems/reverse-string/description/)
2. [125. Valid Palindrome](https://leetcode.com/problems/valid-palindrome/)
3. [58. Length of Last Word](https://leetcode.com/problems/length-of-last-word/description/)
4. [13. Roman to Integer](https://leetcode.com/problems/roman-to-integer/description/)
5. [1903. Largest Odd Number in String](https://leetcode.com/problems/largest-odd-number-in-string/description/)
6. [3. Longest Substring Without Repeating Characters](https://leetcode.com/problems/longest-substring-without-repeating-characters/description/)
7. [14. Longest Common Prefix](https://leetcode.com/problems/longest-common-prefix/description/)
8. [1358. Number of Substrings Containing All Three Characters](https://leetcode.com/problems/number-of-substrings-containing-all-three-characters/description/?envType=daily-question&envId=2025-03-11)
9. [151. Reverse Words in a String](https://leetcode.com/problems/reverse-words-in-a-string/description/?envType=study-plan-v2&envId=top-interview-150)
10. [28. Find the Index of the First Occurrence in a String](https://leetcode.com/problems/find-the-index-of-the-first-occurrence-in-a-string/description/?envType=study-plan-v2&envId=top-interview-150)
11. [1614. Maximum Nesting Depth of the Parentheses](https://leetcode.com/problems/maximum-nesting-depth-of-the-parentheses/description/)
12. [1021. Remove Outermost Parentheses](https://leetcode.com/problems/remove-outermost-parentheses/)
13. [205. Isomorphic Strings](https://leetcode.com/problems/isomorphic-strings/description/)
14. [796. Rotate String](https://leetcode.com/problems/rotate-string/description/)
15. [242. Valid Anagram](https://leetcode.com/problems/valid-anagram/description/)
16. [12. Integer to Roman](https://leetcode.com/problems/integer-to-roman/description/?envType=study-plan-v2&envId=top-interview-150)
17. [8. String to Integer (atoi)](https://leetcode.com/problems/string-to-integer-atoi/description/)
18. [6. Zigzag Conversion](https://leetcode.com/problems/zigzag-conversion/description/?envType=study-plan-v2&envId=top-interview-150)
19. [20. Valid Parentheses](https://leetcode.com/problems/valid-parentheses/description/)

# Arrays
1. [283. Move Zeroes](https://leetcode.com/problems/move-zeroes/description/)
2. [75. Sort Colors](https://leetcode.com/problems/sort-colors/description/)
3. [3487. Maximum Unique Subarray Sum After Deletion](https://leetcode.com/problems/maximum-unique-subarray-sum-after-deletion/description/)
4. [121. Best Time to Buy and Sell Stock](https://leetcode.com/problems/best-time-to-buy-and-sell-stock/description/?envType=study-plan-v2&envId=top-interview-150)
5. [122. Best Time to Buy and Sell Stock II](https://leetcode.com/problems/best-time-to-buy-and-sell-stock-ii/description/)
6. [1. Two Sum](https://leetcode.com/problems/two-sum/description/)
7. [26. Remove Duplicates from Sorted Array](https://leetcode.com/problems/remove-duplicates-from-sorted-array/)
8. [135. Candy](https://leetcode.com/problems/candy/description/?envType=study-plan-v2&envId=top-interview-150)
9. [3638. Maximum Balanced Shipments](https://leetcode.com/problems/maximum-balanced-shipments/description/)
10. [268. Missing Number](https://leetcode.com/problems/missing-number/description/)
11. [485. Max Consecutive Ones](https://leetcode.com/problems/max-consecutive-ones/description/)
12. [136. Single Number](https://leetcode.com/problems/single-number/description/)
13. [169. Majority Element](https://leetcode.com/problems/majority-element/description/)
14. [1752. Check if Array Is Sorted and Rotated](https://leetcode.com/problems/check-if-array-is-sorted-and-rotated/description/)
15. [27. Remove Element](https://leetcode.com/problems/remove-element/description/)
16. [134. Gas Station](https://leetcode.com/problems/gas-station/description/?envType=study-plan-v2&envId=top-interview-150)
17. [219. Contains Duplicate II](https://leetcode.com/problems/contains-duplicate-ii/description/)

# Linked List
1. [237. Delete Node in a Linked List](https://leetcode.com/problems/delete-node-in-a-linked-list/description/)
2. [876. Middle of the Linked List](https://leetcode.com/problems/middle-of-the-linked-list/description/)
3. [206. Reverse Linked List](https://leetcode.com/problems/reverse-linked-list/description/)
4. [328. Odd Even Linked List](https://leetcode.com/problems/odd-even-linked-list/description/)
5. [19. Remove Nth Node From End of List](https://leetcode.com/problems/remove-nth-node-from-end-of-list/description/)
6. [2095. Delete the Middle Node of a Linked List](https://leetcode.com/problems/delete-the-middle-node-of-a-linked-list/description/)
7. [2. Add Two Numbers](https://leetcode.com/problems/add-two-numbers/description/)
8. [160. Intersection of Two Linked Lists](https://leetcode.com/problems/intersection-of-two-linked-lists/description/)
9. [234. Palindrome Linked List](https://leetcode.com/problems/palindrome-linked-list/description/)
10. [141. Linked List Cycle](https://leetcode.com/problems/linked-list-cycle/description/)
11. [142. Linked List Cycle II](https://leetcode.com/problems/linked-list-cycle-ii/description/)
12. [21. Merge Two Sorted Lists](https://leetcode.com/problems/merge-two-sorted-lists/description/)
13. [2807. Insert Greatest Common Divisors in Linked List](https://leetcode.com/problems/insert-greatest-common-divisors-in-linked-list/description/)
14. [2181. Merge Nodes in Between Zeros](https://leetcode.com/problems/merge-nodes-in-between-zeros/description/)

# Stack
1. [20. Valid Parentheses](https://leetcode.com/problems/valid-parentheses/description/)
2. [134. Gas Station](https://leetcode.com/problems/gas-station/description/)
3. [496. Next Greater Element I](https://leetcode.com/problems/next-greater-element-i/description/)
4. [B. Alternating Current](https://codeforces.com/contest/343/problem/B)
5. [503. Next Greater Element II](https://leetcode.com/problems/next-greater-element-ii/description/)
6. [739. Daily Temperatures](https://leetcode.com/problems/daily-temperatures/description/)